<!-- edited by nvanhai CMCSoft-->
<!DOCTYPE Sections SYSTEM "Schema.dtd">
<Sections>
	<Section Dynamic="0" MaxRows="0">
		<Cells>
			<Cell CellID="G_8" Value=""/>
			<Cell CellID="G_7" Value=""/>
			<Cell CellID="G_9" Value=""/>
			<Cell CellID="E_12" Value=""/>
			<Cell CellID="M_12" Value=""/>
			<Cell CellID="V_12" Value=""/>
			<Cell CellID="E_22" Value=""/>
			<Cell CellID="E_24" Value=""/>
			<Cell CellID="M_24" Value=""/>
			<Cell CellID="V_24" Value=""/>
			<Cell CellID="M_22" Value="" MaxLen="20" HelpContexID="01_01_M_10"/>
			<Cell CellID="V_29" Value="" MinValue="0" MaxValue="9999999999" HelpContexID="01_01_V_10"/>
			<Cell CellID="E_28" Value=""/>
			<Cell CellID="M_28" Value="" MaxLen="100" HelpContexID="01_01_M_14"/>
			<Cell CellID="V_22" Value=""/>
			<Cell CellID="K_14" Value=""/>
			<Cell CellID="G_16" Value=""/>
			<Cell CellID="E_18" Value=""/>
			<Cell CellID="M_18" Value=""/>
			<Cell CellID="V_18" Value=""/>
			<Cell CellID="I_19" Value=""/>
			<Cell CellID="S_19" Value=""/>
		</Cells>
	</Section>
	<Section Dynamic="1" MaxRows="0">
		<Cells>
			<Cell CellID="BD_9" FirstCell="0" Value="" MCT="1"/>
			<Cell CellID="BE_9" Value="" MCT="2"/>
			<Cell CellID="BF_9" Value="0" MCT="3"/>
			<Cell CellID="BG_9" Value="0" MCT="4"/>
			<Cell CellID="BH_9" Value="0" MCT="5"/>
		</Cells>
	</Section>
	<Section Dynamic="1" MaxRows="0">
		<Cells>
			<Cell CellID="BD_13" FirstCell="0" Value="" MCT="6"/>
			<Cell CellID="BE_13" Value="" MCT="7"/>
			<Cell CellID="BF_13" Value="0" MCT="8"/>
			<Cell CellID="BG_13" Value="0" MCT="9"/>
			<Cell CellID="BH_13" Value="0" MCT="10"/>
		</Cells>
	</Section>
	<Section Dynamic="0" MaxRows="0">
		<Cells>
			<Cell CellID="B_24" Value="08/05/2012"/>
			<Cell CellID="BE_17" Value="92" MCT="12"/>
			<Cell CellID="BE_18" Value="0" MCT="13"/>
			<Cell CellID="BD_20" Value="" MCT="14"/>
			<Cell CellID="BH_15" Value="0" MCT="15"/>
		</Cells>
	</Section>
</Sections>
