<!-- edited with XML Spy v4.1 U (http://www.xmlspy.com) by CMCSoft-->
<!DOCTYPE Sections SYSTEM "Schema.dtd">
<Sections>
	<Section Dynamic="0" MaxRows="0">
		<Cells>
			<Cell CellID="F_10" Value=""/>
			<Cell CellID="H_8" Value=""/>
			<Cell CellID="F_12" Value=""/>
			<Cell CellID="F_16" Value=""/>
			<Cell CellID="N_16" Value=""/>
			<Cell CellID="V_16" Value=""/>
			<Cell CellID="E_30" Value=""/>
			<Cell CellID="E_32" Value=""/>
			<Cell CellID="M_32" Value=""/>
			<Cell CellID="V_32" Value=""/>
			<Cell CellID="M_30" Value="" MaxLen="20" HelpContexID="01_01_M_10"/>
			<Cell CellID="V_39" Value="" MinValue="0" MaxValue="9999999999" HelpContexID="01_01_V_10"/>
			<Cell CellID="E_36" Value=""/>
			<Cell CellID="M_36" Value="" MaxLen="100" HelpContexID="01_01_M_14"/>
			<Cell CellID="V_30" Value=""/>
			<Cell CellID="H_18" Value=""/>
			<Cell CellID="F_22" Value=""/>
			<Cell CellID="F_26" Value=""/>
			<Cell CellID="N_26" Value=""/>
			<Cell CellID="V_26" Value=""/>
			<Cell CellID="H_28" Value=""/>
			<Cell CellID="N_28" Value=""/>
		</Cells>
	</Section>
	<Section Dynamic="0" MaxRows="0">
		<Cells>
			<Cell CellID="F_20" Value="0100100865"/>
		</Cells>
	</Section>
	<Section Dynamic="0" MaxRows="0">
		<Cells>
			<Cell CellID="H_7" Value=""/>
			<Cell CellID="U_41" Value="3000000" MCT="21"/>
			<Cell CellID="U_42" Value="1000000" MCT="22"/>
			<Cell CellID="U_43" Value="2000000" MCT="23"/>
			<Cell CellID="U_44" Value="12.345" MCT="24"/>
			<Cell CellID="U_46" Value="12.456" MCT="25"/>
			<Cell CellID="K_47" Value=""/>
			<Cell CellID="U_47" Value="15.789" MCT="26"/>
			<Cell CellID="U_48" Value="54360" MCT="27"/>
			<Cell CellID="U_49" Value="15377" MCT="28"/>
			<Cell CellID="U_50" Value="38983" MCT="29"/>
			<Cell CellID="U_52" Value="0" MCT="30"/>
			<Cell CellID="U_53" Value="54360" MCT="31"/>
			<Cell CellID="E_38" Value=""/>
		</Cells>
	</Section>
	<Section Dynamic="0" MaxRows="0">
		<Cells>
			<Cell CellID="T_57" Value=""/>
			<Cell CellID="T_59" Value="03/05/2012"/>
			<Cell CellID="H_57" Value="25465"/>
			<Cell CellID="H_59" Value="5456"/>
			<Cell CellID="C_62" Value="1"/>
			<Cell CellID="I_62" Value=""/>
			<Cell CellID="L_62" Value="1052"/>
		</Cells>
	</Section>
</Sections>
