<!-- edited with XML Spy v4.1 U (http://www.xmlspy.com) by CMCSoft-->
<!DOCTYPE Sections SYSTEM "Schema.dtd">
<Sections>
	<Section Dynamic="0" MaxRows="0">
		<Cells>
			<Cell CellID="G_8" Value=""/>
			<Cell CellID="G_7" Value=""/>
			<Cell CellID="G_9" Value=""/>
			<Cell CellID="E_12" Value=""/>
			<Cell CellID="M_12" Value=""/>
			<Cell CellID="V_12" Value=""/>
			<Cell CellID="E_22" Value=""/>
			<Cell CellID="E_24" Value=""/>
			<Cell CellID="M_24" Value=""/>
			<Cell CellID="V_24" Value=""/>
			<Cell CellID="M_22" Value="" MaxLen="20" HelpContexID="01_01_M_10"/>
			<Cell CellID="V_29" Value="" MinValue="0" MaxValue="9999999999" HelpContexID="01_01_V_10"/>
			<Cell CellID="E_28" Value=""/>
			<Cell CellID="M_28" Value="" MaxLen="100" HelpContexID="01_01_M_14"/>
			<Cell CellID="V_22" Value=""/>
			<Cell CellID="K_14" Value=""/>
			<Cell CellID="G_16" Value=""/>
			<Cell CellID="E_18" Value=""/>
			<Cell CellID="M_18" Value=""/>
			<Cell CellID="V_18" Value=""/>
			<Cell CellID="I_19" Value=""/>
			<Cell CellID="S_19" Value=""/>
		</Cells>
	</Section>
	<Section Dynamic="0" MaxRows="0">
		<Cells>
			<Cell CellID="G_15" Value="6868686868"/>
		</Cells>
	</Section>
	<Section Dynamic="0" MaxRows="0">
		<Cells>
			<Cell CellID="S_42" Value="10000000" MCT="2"/>
			<Cell CellID="S_43" Value="500000" MCT="3"/>
			<Cell CellID="S_45" Value="2000000" MCT="5"/>
			<Cell CellID="S_46" Value="2000" MCT="6"/>
			<Cell CellID="S_48" Value="1000000" MCT="8"/>
			<Cell CellID="S_49" Value="50000" MCT="9"/>
			<Cell CellID="S_52" Value="100000" MCT="11"/>
			<Cell CellID="S_53" Value="10000" MCT="12"/>
			<Cell CellID="S_55" Value="10000000" MCT="14"/>
			<Cell CellID="S_56" Value="10000" MCT="15"/>
		</Cells>
	</Section>
	<Section Dynamic="0" MaxRows="0">
		<Cells>
			<Cell CellID="R_58" Value=""/>
			<Cell CellID="R_60" Value="08/08/2011"/>
			<Cell CellID="G_58" Value="test"/>
			<Cell CellID="G_60" Value="asdasdad"/>
			<Cell CellID="C_61" Value="1"/>
			<Cell CellID="F_61" Value=""/>
			<Cell CellID="I_61" Value=""/>
			<Cell CellID="B_41" Value="I" MCT="I" Receive="0"/>
			<Cell CellID="B_44" Value="II" MCT="II" Receive="0"/>
			<Cell CellID="B_47" Value="III" MCT="III" Receive="0"/>
			<Cell CellID="B_50" Value="IV" MCT="IV" Receive="0"/>
			<Cell CellID="B_54" Value="V" MCT="V" Receive="0"/>
		</Cells>
	</Section>
</Sections>
