<!-- Edited by hlnam FIS_CMC-->
<!DOCTYPE Sections SYSTEM "Schema.dtd">
<Sections>
	<Section Dynamic="0" MaxRows="0">
		<Cells>
			<Cell CellID="F_10" Value=""/>
			<Cell CellID="H_8" Value=""/>
			<Cell CellID="F_12" Value=""/>
			<Cell CellID="F_16" Value=""/>
			<Cell CellID="N_16" Value=""/>
			<Cell CellID="V_16" Value=""/>
			<Cell CellID="E_30" Value=""/>
			<Cell CellID="E_32" Value=""/>
			<Cell CellID="M_32" Value=""/>
			<Cell CellID="V_32" Value=""/>
			<Cell CellID="M_30" Value="" MaxLen="20" HelpContexID="01_01_M_10"/>
			<Cell CellID="V_39" Value="" MinValue="0" MaxValue="9999999999" HelpContexID="01_01_V_10"/>
			<Cell CellID="E_36" Value=""/>
			<Cell CellID="M_36" Value="" MaxLen="100" HelpContexID="01_01_M_14"/>
			<Cell CellID="V_30" Value=""/>
			<Cell CellID="H_18" Value=""/>
			<Cell CellID="F_22" Value=""/>
			<Cell CellID="F_26" Value=""/>
			<Cell CellID="N_26" Value=""/>
			<Cell CellID="V_26" Value=""/>
			<Cell CellID="H_28" Value=""/>
			<Cell CellID="N_28" Value=""/>
		</Cells>
	</Section>
	<Section Dynamic="0" MaxRows="0">
		<Cells>
			<Cell CellID="F_20" Value="2222222222"/>
		</Cells>
	</Section>
	<Section Dynamic="0" MaxRows="0">
		<Cells>
			<Cell CellID="U_43" Value="1000000000" MCT="21"/>
			<Cell CellID="U_44" Value="50000000" MCT="22"/>
			<Cell CellID="U_46" Value="100000000" MCT="23"/>
			<Cell CellID="U_47" Value="0" MCT="24"/>
			<Cell CellID="U_49" Value="0" MCT="25"/>
			<Cell CellID="U_50" Value="0" MCT="26"/>
			<Cell CellID="U_52" Value="53453534" MCT="27"/>
			<Cell CellID="U_53" Value="345353" MCT="28"/>
			<Cell CellID="U_55" Value="34534534535" MCT="29"/>
			<Cell CellID="U_56" Value="345345" MCT="30"/>
			<Cell CellID="U_57" Value="345345345" MCT="31"/>
		</Cells>
	</Section>
	<Section Dynamic="0" MaxRows="0">
		<Cells>
			<Cell CellID="T_61" Value="iiiii"/>
			<Cell CellID="T_63" Value="10/01/2012"/>
			<Cell CellID="G_61" Value="Â¸df"/>
			<Cell CellID="G_63" Value="sdfsdf"/>
			<Cell CellID="C_64" Value="1"/>
			<Cell CellID="I_64" Value=""/>
		</Cells>
	</Section>
</Sections>
