<!-- edited with XML Spy v4.1 U (http://www.xmlspy.com) by CMCSoft-->
<!DOCTYPE Sections SYSTEM "Schema.dtd">
<Sections>
	<Section Dynamic="0" MaxRows="0">
		<Cells>
			<Cell CellID="G_4" Value=""/>
			<Cell CellID="G_5" Value=""/>
			<Cell CellID="G_6" Value=""/>
			<Cell CellID="E_8" Value=""/>
			<Cell CellID="M_8" Value=""/>
			<Cell CellID="V_8" Value=""/>
			<Cell CellID="E_10" Value=""/>
			<Cell CellID="E_12" Value=""/>
			<Cell CellID="M_12" Value=""/>
			<Cell CellID="V_12" Value=""/>
			<Cell CellID="M_10" Value="" MaxLen="20" HelpContexID="01_01_M_10"/>
			<Cell CellID="V_16" Value="" MinValue="0" MaxValue="9999999999" HelpContexID="01_01_V_10"/>
			<Cell CellID="E_14" Value=""/>
			<Cell CellID="M_14" Value="" MaxLen="100" HelpContexID="01_01_M_14"/>
			<Cell CellID="V_10" Value="" MaxLen="60"/>
		</Cells>
	</Section>
	<Section Dynamic="1" MaxRows="0">
		<Cells>
			<Cell CellID="C_24" FirstCell="0" Value="a1" MCT="2"/>
			<Cell CellID="D_24" Value="12312" MCT="3"/>
			<Cell CellID="E_24" Value="01/01/2010" MCT="4"/>
			<Cell CellID="F_24" Value="test" MCT="5"/>
			<Cell CellID="G_24" Value="10000.00" MCT="6"/>
			<Cell CellID="H_24" Value="100000" MCT="7"/>
			<Cell CellID="J_24" Value="0" MCT="9"/>
			<Cell CellID="K_24" Value="100000" MCT="10"/>
		</Cells>
	</Section>
	<Section Dynamic="1" MaxRows="0">
		<Cells>
			<Cell CellID="C_34" FirstCell="0" Value="test1" MCT="15"/>
			<Cell CellID="E_34" Value="200.00" MCT="16"/>
			<Cell CellID="F_34" Value="as" MCT="17"/>
			<Cell CellID="H_34" Value="20.00" MCT="18"/>
			<Cell CellID="J_34" Value="150.00" MCT="19"/>
		</Cells>
	</Section>
</Sections>
