<!-- edited with XML Spy v4.1 U (http://www.xmlspy.com) by CMCSoft-->
<!DOCTYPE Sections SYSTEM "Schema.dtd">
<Sections>
	<Section Dynamic="0" MaxRows="0">
		<Cells>
			<Cell CellID="F_10" Value=""/>
			<Cell CellID="H_8" Value=""/>
			<Cell CellID="F_12" Value=""/>
			<Cell CellID="F_16" Value=""/>
			<Cell CellID="N_16" Value=""/>
			<Cell CellID="V_16" Value=""/>
			<Cell CellID="E_30" Value=""/>
			<Cell CellID="E_32" Value=""/>
			<Cell CellID="M_32" Value=""/>
			<Cell CellID="V_32" Value=""/>
			<Cell CellID="M_30" Value="" MaxLen="20" HelpContexID="01_01_M_10"/>
			<Cell CellID="V_39" Value="" MinValue="0" MaxValue="9999999999" HelpContexID="01_01_V_10"/>
			<Cell CellID="E_36" Value=""/>
			<Cell CellID="M_36" Value="" MaxLen="100" HelpContexID="01_01_M_14"/>
			<Cell CellID="V_30" Value=""/>

			<Cell CellID="H_18" Value=""/>
			<Cell CellID="F_22" Value=""/>
			<Cell CellID="F_26" Value=""/>
			<Cell CellID="N_26" Value=""/>
			<Cell CellID="V_26" Value=""/>
			<Cell CellID="H_28" Value=""/>
			<Cell CellID="N_28" Value=""/>			
		</Cells>
	</Section>
	<Section Dynamic="0" MaxRows="0">
		<Cells>
			<Cell CellID="F_20" Value=""/>
		</Cells>
	</Section>
	<Section Dynamic="0" MaxRows="0">
		<Cells>
			<Cell CellID="S_42" Value="" MCT="21" />
			<Cell CellID="S_43" Value="" MCT="22" />
			<Cell CellID="S_44" Value="" MCT="23" />
			<Cell CellID="S_45" Value="" MCT="24" />
			<Cell CellID="S_46" Value="" MCT="25" />
		</Cells>
	</Section>
	<Section Dynamic="0" MaxRows="0">
		<Cells>
			<Cell CellID="T_58" Value=""/>
			<Cell CellID="T_60" Value=""/>
			<Cell CellID="H_58" Value=""/>
			<Cell CellID="H_60" Value=""/>
			<Cell CellID="C_62" Value=""/>
			<Cell CellID="I_62" Value=""/>
		</Cells>
	</Section>
</Sections>
