<!-- edited with XML Spy v4.1 U (http://www.xmlspy.com) by CMCSOFT -->
<!DOCTYPE Sections SYSTEM "Schema.dtd">
<Sections Version="120">
	<Section Dynamic="0" MaxRows="0">
		<Cells>
			<Cell CellID="B_2" HelpContextID="0"/>
			<Cell CellID="B_4" HelpContextID="0"/>
			<Cell CellID="B_5" HelpContextID="0"/>
			<Cell CellID="B_7" HelpContextID="0"/>
			<Cell CellID="B_8" HelpContextID="0"/>
			<Cell CellID="B_9" HelpContextID="0"/>
			<Cell CellID="B_10" HelpContextID="0"/>
			<Cell CellID="B_11" HelpContextID="0"/>
			<Cell CellID="B_12" HelpContextID="0"/>
			<Cell CellID="B_15" HelpContextID="0"/>
			<Cell CellID="B_16" HelpContextID="0"/>
			<Cell CellID="B_18" HelpContextID="0"/>
			<Cell CellID="B_20" HelpContextID="0"/>
			<Cell CellID="B_21" HelpContextID="0"/>
			<Cell CellID="B_22" HelpContextID="0"/>
			<Cell CellID="B_24" HelpContextID="0"/>
			<Cell CellID="B_25" HelpContextID="0"/>
			<Cell CellID="B_26" HelpContextID="0"/>
			<Cell CellID="B_27" HelpContextID="0"/>
			<Cell CellID="B_29" HelpContextID="0"/>
			<Cell CellID="B_30" HelpContextID="0"/>
			<Cell CellID="B_31" HelpContextID="0"/>
			<Cell CellID="B_33" HelpContextID="0"/>
			<Cell CellID="B_35" HelpContextID="0"/>
			<Cell CellID="B_38" HelpContextID="0"/>
			<Cell CellID="B_39" HelpContextID="0"/>
			<Cell CellID="B_40" HelpContextID="0"/>
			<Cell CellID="B_41" HelpContextID="0"/>
			<Cell CellID="B_42" HelpContextID="0"/>
			<Cell CellID="B_43" HelpContextID="0"/>
			<Cell CellID="B_44" HelpContextID="0"/>
			<Cell CellID="B_45" HelpContextID="0"/>
			<Cell CellID="B_46" HelpContextID="0"/>
			<Cell CellID="B_47" HelpContextID="0"/>
			<Cell CellID="B_49" HelpContextID="0"/>
			<Cell CellID="B_50" HelpContextID="0"/>
			<Cell CellID="B_51" HelpContextID="0"/>
			<Cell CellID="B_53" HelpContextID="0"/>
			<Cell CellID="B_54" HelpContextID="0"/>
			<Cell CellID="B_56" HelpContextID="0"/>
			<Cell CellID="B_57" HelpContextID="0"/>
			<Cell CellID="B_59" HelpContextID="0"/>
			<Cell CellID="B_60" HelpContextID="0"/>
			<Cell CellID="B_62" HelpContextID="0"/>
			<Cell CellID="B_63" HelpContextID="0"/>
			<Cell CellID="B_64" HelpContextID="0"/>
			<Cell CellID="B_65" HelpContextID="0"/>
			<Cell CellID="B_67" HelpContextID="0"/>
			<Cell CellID="B_69" HelpContextID="0"/>
		</Cells>
	</Section>
</Sections>
