<!-- edited with XML Spy v4.1 U (http://www.xmlspy.com) by CMCSoft-->
<!DOCTYPE Sections SYSTEM "Schema.dtd">
<Sections>
	<Section Dynamic="0" MaxRows="0">
		<Cells>
			<Cell CellID="F_10" Value=""/>
			<Cell CellID="H_8" Value=""/>
			<Cell CellID="F_12" Value=""/>
			<Cell CellID="F_16" Value=""/>
			<Cell CellID="N_16" Value=""/>
			<Cell CellID="V_16" Value=""/>
			<Cell CellID="E_30" Value=""/>
			<Cell CellID="E_32" Value=""/>
			<Cell CellID="M_32" Value=""/>
			<Cell CellID="V_32" Value=""/>
			<Cell CellID="M_30" Value="" MaxLen="20" HelpContexID="01_01_M_10"/>
			<Cell CellID="V_39" Value="" MinValue="0" MaxValue="9999999999" HelpContexID="01_01_V_10"/>
			<Cell CellID="E_36" Value=""/>
			<Cell CellID="M_36" Value="" MaxLen="100" HelpContexID="01_01_M_14"/>
			<Cell CellID="V_30" Value=""/>
			<Cell CellID="H_18" Value=""/>
			<Cell CellID="F_22" Value=""/>
			<Cell CellID="F_26" Value=""/>
			<Cell CellID="N_26" Value=""/>
			<Cell CellID="V_26" Value=""/>
			<Cell CellID="H_28" Value=""/>
			<Cell CellID="N_28" Value=""/>
		</Cells>
	</Section>
	<Section Dynamic="0" MaxRows="0">
		<Cells>
			<Cell CellID="F_20" Value=""/>
		</Cells>
	</Section>
	<Section Dynamic="1" MaxRows="0">
		<Cells>
			<Cell CellID="AV_44" FirstCell="0" Value="01" MCT="1"/>
			<Cell CellID="N_44" Value="" MCT="2"/>
			<Cell CellID="S_44" Value="" MCT="3"/>
			<Cell CellID="X_44" Value="0" MCT="4"/>
			<Cell CellID="AC_44" Value="" MCT="5"/>
			<Cell CellID="AF_44" Value="2000000000" MCT="6"/>
			<Cell CellID="AK_44" Value="1" MCT="7"/>
			<Cell CellID="AL_44" Value="0" MCT="8"/>
			<Cell CellID="AQ_44" Value="20000000" MCT="9"/>
		</Cells>
		<Cells>
			<Cell CellID="AV_45" FirstCell="1" Value="04" MCT="1"/>
			<Cell CellID="N_45" Value="" MCT="2"/>
			<Cell CellID="S_45" Value="" MCT="3"/>
			<Cell CellID="X_45" Value="0" MCT="4"/>
			<Cell CellID="AC_45" Value="" MCT="5"/>
			<Cell CellID="AF_45" Value="400000000" MCT="6"/>
			<Cell CellID="AK_45" Value="2" MCT="7"/>
			<Cell CellID="AL_45" Value="0" MCT="8"/>
			<Cell CellID="AQ_45" Value="8000000" MCT="9"/>
		</Cells>
	</Section>
	<Section Dynamic="0" MaxRows="0">
		<Cells>
			<Cell CellID="X_47" Value="0" MCT="10"/>
			<Cell CellID="AF_47" Value="2400000000" MCT="11"/>
			<Cell CellID="AL_47" Value="0" MCT="12"/>
			<Cell CellID="AQ_47" Value="28000000" MCT="13"/>
		</Cells>
	</Section>
	<Section Dynamic="0" MaxRows="0">
		<Cells>
			<Cell CellID="P_37" Value="1"/>
			<Cell CellID="Q_37" Value=""/>
		</Cells>
	</Section>
	<Section Dynamic="0" MaxRows="0">
		<Cells>
			<Cell CellID="J_54" Value=""/>
			<Cell CellID="AH_54" Value="NguyÔn §×nh Phóc"/>
			<Cell CellID="J_56" Value=""/>
			<Cell CellID="AH_56" Value="08/05/2012"/>
			<Cell CellID="M_37" Value=""/>
			<Cell CellID="N_37" Value="1"/>
			<Cell CellID="O_37" Value="1"/>
			<Cell CellID="S_37" Value=""/>
		</Cells>
	</Section>
</Sections>
