<!-- edited with XML Spy v4.1 U (http://www.xmlspy.com) by CMCSoft-->
<!DOCTYPE Sections SYSTEM "Schema.dtd">
<Sections>
	<Section Dynamic="0" MaxRows="0">
		<Cells>
			<Cell CellID="F_10" Value=""/>
			<Cell CellID="H_8" Value=""/>
			<Cell CellID="F_12" Value=""/>
			<Cell CellID="F_16" Value=""/>
			<Cell CellID="N_16" Value=""/>
			<Cell CellID="V_16" Value=""/>
			<Cell CellID="E_30" Value=""/>
			<Cell CellID="E_32" Value=""/>
			<Cell CellID="M_32" Value=""/>
			<Cell CellID="V_32" Value=""/>
			<Cell CellID="M_30" Value="" MaxLen="20" HelpContexID="01_01_M_10"/>
			<Cell CellID="V_39" Value="" MinValue="0" MaxValue="9999999999" HelpContexID="01_01_V_10"/>
			<Cell CellID="E_36" Value=""/>
			<Cell CellID="M_36" Value="" MaxLen="100" HelpContexID="01_01_M_14"/>
			<Cell CellID="V_30" Value=""/>

			<Cell CellID="H_18" Value=""/>
			<Cell CellID="F_22" Value=""/>
			<Cell CellID="F_26" Value=""/>
			<Cell CellID="N_26" Value=""/>
			<Cell CellID="V_26" Value=""/>
			<Cell CellID="H_28" Value=""/>
			<Cell CellID="N_28" Value=""/>
		</Cells>
	</Section>
	<Section Dynamic="0" MaxRows="0">
		<Cells>
			<Cell CellID="F_20" Value=""/>
		</Cells>
	</Section>
	<Section Dynamic="0" MaxRows="0">
		<Cells>
			<Cell CellID="Q_42" Value="0" MCT="21"/>
			<Cell CellID="Q_43" Value="0" MCT="22"/>
			<Cell CellID="Q_44" Value="0" MCT="23"/>
			<Cell CellID="Q_45" Value="0" MCT="24"/>
			<Cell CellID="Q_46" Value="0" MCT="25"/>
			<Cell CellID="Q_47" Value="0" MCT="26"/>
			<Cell CellID="Q_48" Value="0" MCT="27"/>
		</Cells>
	</Section>
	<Section Dynamic="0" MaxRows="0">
		<Cells>
			<Cell CellID="H_56" Value=""/>
			<Cell CellID="R_56" Value=""/>
			<Cell CellID="H_58" Value=""/>
			<Cell CellID="R_58" Value=""/>
			<Cell CellID="C_61" Value=""/>
			<Cell CellID="F_61" Value=""/>
			<Cell CellID="I_61" Value=""/>
			<Cell CellID="L_61" Value=""/>
		</Cells>
	</Section>	
</Sections>
