<!-- Edited by hlnam FIS_CMC-->
<!DOCTYPE Sections SYSTEM "Schema.dtd">
<Sections>
	<Section Dynamic="0" MaxRows="0">
		<Cells>
			<Cell CellID="G_4" Value=""/>
			<Cell CellID="G_5" Value=""/>
			<Cell CellID="G_6" Value=""/>
			<Cell CellID="E_8" Value=""/>
			<Cell CellID="M_8" Value=""/>
			<Cell CellID="V_8" Value=""/>
			<Cell CellID="E_10" Value=""/>
			<Cell CellID="E_12" Value=""/>
			<Cell CellID="M_12" Value=""/>
			<Cell CellID="V_12" Value=""/>
			<Cell CellID="M_10" Value="" MaxLen="20" HelpContexID="01_01_M_10"/>
			<Cell CellID="V_16" Value="" MinValue="0" MaxValue="9999999999" HelpContexID="01_01_V_10"/>
			<Cell CellID="E_14" Value=""/>
			<Cell CellID="M_14" Value="" MaxLen="100" HelpContexID="01_01_M_14"/>
			<Cell CellID="V_10" Value="" MaxLen="60"/>
		</Cells>
	</Section>
	<Section Dynamic="0" MaxRows="0">
		<Cells>
			<Cell CellID="G_35" Value="07/2009"/>
			<Cell CellID="I_35" Value="12/2009"/>
			<Cell CellID="D_36" Value=""/>
			<Cell CellID="I_36" Value=""/>
		</Cells>
	</Section>
	<Section Dynamic="0" MaxRows="0">
		<Cells>
			<Cell CellID="U_40" Value="400000000" MCT="1"/>
			<Cell CellID="U_41" Value="200000000" MCT="2"/>
			<Cell CellID="U_42" Value="200000000" MCT="3"/>
			<Cell CellID="U_43" Value="100000000" MCT="4"/>
			<Cell CellID="U_44" Value="0" MCT="5"/>
			<Cell CellID="U_45" Value="0" MCT="6"/>
			<Cell CellID="U_46" Value="0" MCT="7"/>
			<Cell CellID="U_47" Value="43200000" MCT="8"/>
			<Cell CellID="U_48" Value="24000000" MCT="9"/>
			<Cell CellID="U_49" Value="19200000" MCT="10"/>
			<Cell CellID="U_50" Value="0" MCT="11"/>
			<Cell CellID="U_51" Value="0" MCT="12"/>
			<Cell CellID="U_52" Value="356800000" MCT="13"/>
			<Cell CellID="U_53" Value="71940001" MCT="14"/>
			<Cell CellID="U_54" Value="36000000" MCT="15"/>
			<Cell CellID="U_55" Value="10000000" MCT="16"/>
			<Cell CellID="U_56" Value="26000000" MCT="17"/>
			<Cell CellID="U_57" Value="0" MCT="18"/>
			<Cell CellID="U_58" Value="0" MCT="19"/>
			<Cell CellID="U_59" Value="35940001" MCT="20"/>
			<Cell CellID="U_60" Value="0" MCT="21"/>
			<Cell CellID="U_61" Value="0" MCT="22"/>
			<Cell CellID="U_62" Value="0" MCT="23"/>
		</Cells>
	</Section>
	<Section Dynamic="0" MaxRows="0">
		<Cells>
			<Cell CellID="R_64" Value="Nguyen Van An"/>
			<Cell CellID="R_66" Value="25/03/2010"/>
			<Cell CellID="C_67" Value="1"/>
			<Cell CellID="F_67" Value=""/>
			<Cell CellID="I_67" Value=""/>
		</Cells>
	</Section>
</Sections>
