<!-- edited by Htphuong (CMCSoft - HN) -->
<!DOCTYPE Sections SYSTEM "Schema.dtd">
<Sections>
	<Section Dynamic="0" MaxRows="0">
		<Cells>
			<Cell CellID="C_4a" Value="2###0101a###Khoáng sản kim loại đen###Kg###2###0###1###1553"/>
			<Cell CellID="C_4b" Value="71###0101b###Khoáng sản kim loại đen###Kg###5###0###1###1553"/>
			<Cell CellID="C_5" Value="3###010101###Khoáng sản sắt, mangan, crôm, titan###Kg###5###0###1###1553"/>
			<Cell CellID="C_7" Value="5###010201###Vàng sa khoáng###Kg###6###0###1###1554"/>
			<Cell CellID="C_8" Value="6###010202###Vàng cốm###Kg###6###0###1###1554"/>
			<Cell CellID="C_9a" Value="7###010203a###Đất hiếm###Kg###4###0###1###1554"/>
			<Cell CellID="C_9b" Value="76###010203b###Đất hiếm###Kg###8###0###1###1554"/>
			<Cell CellID="C_10" Value="8###010204###Bạch kim, thiếc, Won fram, bạc, antimoan###Kg###5###0###1###1554"/>
			<Cell CellID="C_11a" Value="9###010205a###Chì,kẽm,nhôm,bô xít,đồng,niken, coban, Hg, Mg ...###Kg###3###0###1###1553"/>
			<Cell CellID="C_11b" Value="78###010205b###Chì,kẽm,nhôm,bô xít,đồng,niken, coban, Hg, Mg ...###Kg###5###0###1###1553"/>
			<Cell CellID="C_12a" Value="10###010206a###Các loại khoáng sản kim loại màu khác###Kg###2###0###1###1553"/>
			<Cell CellID="C_12b" Value="79###010206b###Các loại khoáng sản kim loại màu khác###Kg###5###0###1###1553"/>
			<Cell CellID="C_15" Value="13###020101###Đất khai thác, san lấp, xây đắp công trình###M3###1###0###1###1555"/>
			<Cell CellID="C_16a" Value="14###020102a###K.sản không k loại dùng làm VLXD khác (đá,cát,sỏi)###M3###2###0###1###1555"/>
			<Cell CellID="C_16b" Value="83###020102b###K.sản không k loại dùng làm VLXD khác (đá,cát,sỏi)###M3###4###0###1###1555"/>
			<Cell CellID="C_18a" Value="16###020201a###Granit, đô nô mit, sét chịu lửa ..###M3###3###0###1###1555"/>
			<Cell CellID="C_18b" Value="85###020201b###Granit, đô nô mit, sét chịu lửa ..###M3###5###0###1###1555"/>
			<Cell CellID="C_20" Value="18###020301###Apatít, Secpăngtin###M3###2###0###1###1555"/>
			<Cell CellID="C_21a" Value="67###020302a###Pirit,Phosphosit,cao lanh,mica,...###M3###4###0###1###1555"/>
			<Cell CellID="C_21b" Value="88###020302b###Pirit,Phosphosit,cao lanh,mica,...###M3###5###0###1###1555"/>
			<Cell CellID="C_22" Value="19###0206###Khoáng sản không kim loại khác###M3###2###0###1###1555"/>
			<Cell CellID="C_24a" Value="21###0301a###Than an tra xit hầm lò###Tấn###1###0###1###1555"/>
			<Cell CellID="C_24b" Value="91###0301b###Than an tra xit hầm lò###Tấn###2###0###1###1555"/>
			<Cell CellID="C_25a" Value="22###0302a###Than an tra xit lộ thiên###Tấn###2###0###1###1555"/>
			<Cell CellID="C_25b" Value="92###0302b###Than an tra xit lộ thiên###Tấn###3###0###1###1555"/>
			<Cell CellID="C_26" Value="23###0303###Than nâu, than mỡ###Tấn###3###0###1###1555"/>
			<Cell CellID="C_27" Value="24###0304###Than khác###Tấn###2###0###1###1555"/>
			<Cell CellID="C_29" Value="26###0401###Kim cương, rubi, saphia ...###M3###8###0###1###1554"/>
			<Cell CellID="C_30" Value="27###0402###Adrit, rô đô lit, py rốp, ...###M3###5###0###1###1554"/>
			<Cell CellID="C_31" Value="28###0403###Các loại đá quý khác###M3###3###0###1###1554"/>
			<Cell CellID="C_33" Value="30###0501###Dầu mỏ###Tấn###18###1###1###1551"/>
			<Cell CellID="C_35" Value="32###0601###Khí đốt###M3###8###1###1###1551"/>
			<Cell CellID="C_38" Value="35###070101###Gỗ nhóm 1###M3###40###0###1###1557"/>
			<Cell CellID="C_39" Value="36###070102###Gỗ nhóm 2###M3###35###0###1###1557"/>
			<Cell CellID="C_40" Value="37###070103###Gỗ nhóm 3 , 4###M3###25###0###1###1557"/>
			<Cell CellID="C_41" Value="38###070104###Gỗ nhóm 5,6,7,8###M3###15###0###1###1557"/>
			<Cell CellID="C_42" Value="39###0702###Gỗ Trụ mỏ###M3###15###0###1###1557"/>
			<Cell CellID="C_43" Value="40###0703###Gỗ làm nguyên liệu giấy###M3###20###0###1###1557"/>
			<Cell CellID="C_44" Value="41###0704###Gỗ cột buồm, cọc đáy###M3###20###0###1###1557"/>
			<Cell CellID="C_45a" Value="42###0705a###Gỗ tẩm, đước###M3###25###0###1###1557"/>
			<Cell CellID="C_45b" Value="112###0705b###Gỗ tẩm, đước###M3###15###0###1###1557"/>
			<Cell CellID="C_46" Value="43###0706###Gỗ cành, ngọn, củi###M3###5###0###1###1557"/>
			<Cell CellID="C_47" Value="44###0707###Tre, nứa..###M3###10###0###1###1557"/>
			<Cell CellID="C_49" Value="46###070801###Trầm hương, bakích, kỳ nam###Kg###25###0###1###1557"/>
			<Cell CellID="C_50" Value="47###070802###Hồi , quế, sa nhân, thảo quả###Kg###10###0###1###1557"/>
			<Cell CellID="C_51" Value="48###070803###Các loại dược liệu khác###Kg###5###0###1###1557"/>
			<Cell CellID="C_53" Value="50###070901###Chim thú rừng (loại được phép khai thác)###Kg###20###0###1###1557"/>
			<Cell CellID="C_54" Value="51###070902###Sản phẩm rừng tự nhiên khác###Kg###5###0###1###1557"/>
			<Cell CellID="C_56" Value="53###0801###Ngọc trai, bào ngư, hải sâm###Kg###10###0###1###1556"/>
			<Cell CellID="C_57" Value="54###0802###Tôm cá mực và các loại thuỷ sản khác###Kg###2###0###1###1556"/>
			<Cell CellID="C_59a" Value="56###0901a###Nước khoáng TN, nước TN tinh lọc đóng chai hộp###M3###4###0###1###1599"/>
			<Cell CellID="C_59b" Value="126###0901b###Nước khoáng TN, nước TN tinh lọc đóng chai hộp###M3###8###0###1###1599"/>
			<Cell CellID="C_60" Value="57###0902###Nước TN dùng sản xuất thuỷ điện###KW/h###2###0###1###1552"/>
			<Cell CellID="C_62" Value="59###090301###Nước TN sử dụng làm NL tạo thành yếu tố VC trong SXSF###M3###3###0###1###1599"/>
			<Cell CellID="C_63" Value="60###090302###Nước TN sử dụng chung phục vụ SX###M3###1###0###1###1599"/>
			<Cell CellID="C_64" Value="61###090303###Nước TN dùng SX nước sạch, phục vụ khác###M3###0###0###1###1599"/>
			<Cell CellID="C_65" Value="62###0904###Nước TN khai thác dùng vào các mục đích khác###M3###0###0###1###1599"/>
			<Cell CellID="C_67" Value="64###1001###Yến sào###Kg###20###0###1###1599"/>
			<Cell CellID="C_69" Value="66###1101###Tài nguyên khác###Kg###10###1###1###1599"/>
		</Cells>
	</Section>
</Sections>
