<!-- edited with XML Spy v4.1 U (http://www.xmlspy.com) by CMCSoft-->
<!DOCTYPE Sections SYSTEM "Schema.dtd">
<Sections>
	<Section Dynamic="0" MaxRows="0">
		<Cells>
			<Cell CellID="I_7" Value=""/>
			<Cell CellID="I_5" Value=""/>
			<Cell CellID="I_9" Value=""/>
			<Cell CellID="I_11" Value=""/>
			<Cell CellID="S_11" Value=""/>
			<Cell CellID="AG_11" Value=""/>
			<Cell CellID="F_23" Value=""/>
			<Cell CellID="F_25" Value=""/>
			<Cell CellID="S_25" Value=""/>
			<Cell CellID="AG_25" Value=""/>
			<Cell CellID="S_23" Value=""/>
			<Cell CellID="M_39" Value=""/>
			<Cell CellID="G_29" Value=""/>
			<Cell CellID="S_29" Value=""/>
			<Cell CellID="AG_23" Value=""/>
			<Cell CellID="I_13" Value=""/>
			<Cell CellID="I_17" Value=""/>
			<Cell CellID="I_19" Value=""/>
			<Cell CellID="S_19" Value="" MaxLen="60"/>
			<Cell CellID="AG_19" Value=""/>
			<Cell CellID="I_21" Value=""/>
			<Cell CellID="S_21" Value=""/>
		</Cells>
	</Section>
	<Section Dynamic="0" MaxRows="0">
		<Cells>
			<Cell CellID="I_15" Value=""/>
		</Cells>
	</Section>
	<Section Dynamic="0" MaxRows="0">
		<Cells>
			<Cell CellID="N_49" Value="" MCT="1"/>
			<Cell CellID="X_51" Value="9000000" MCT="2"/>
			<Cell CellID="AC_51" Value="6206897.00" MCT="3"/>
			<Cell CellID="AH_51" Value="900000" MCT="4"/>
			<Cell CellID="AK_51" Value="0"/>
			<Cell CellID="AO_51" Value="1893103" MCT="5"/>
		</Cells>
	</Section>
	<Section Dynamic="1" MaxRows="0">
		<Cells>
			<Cell CellID="C_53" FirstCell="0" Value="10200" MCT="6"/>
			<Cell CellID="P_53" Value="LÝt" MCT="7"/>
			<Cell CellID="S_53" Value="100.00" MCT="8"/>
			<Cell CellID="X_53" Value="4000000" MCT="9"/>
			<Cell CellID="AC_53" Value="2758621.00" MCT="10"/>
			<Cell CellID="AE_53" Value="45.0" MCT="11"/>
			<Cell CellID="AH_53" Value="300000" MCT="12"/>
			<Cell CellID="AK_53" Value="0" MCT="13"/>
			<Cell CellID="AO_53" Value="941379" MCT="14"/>
		</Cells>
		<Cells>
			<Cell CellID="C_54" FirstCell="1" Value="10300" MCT="6"/>
			<Cell CellID="P_54" Value="LÝt" MCT="7"/>
			<Cell CellID="S_54" Value="200.00" MCT="8"/>
			<Cell CellID="X_54" Value="5000000" MCT="9"/>
			<Cell CellID="AC_54" Value="3448276.00" MCT="10"/>
			<Cell CellID="AE_54" Value="45.0" MCT="11"/>
			<Cell CellID="AH_54" Value="600000" MCT="12"/>
			<Cell CellID="AK_54" Value="0" MCT="13"/>
			<Cell CellID="AO_54" Value="951724" MCT="14"/>
		</Cells>
	</Section>
	<Section Dynamic="0" MaxRows="0">
		<Cells>
			<Cell CellID="X_56" Value="10000000" MCT="15"/>
			<Cell CellID="AC_56" Value="7692308.00" MCT="16"/>
			<Cell CellID="AH_56" Value="600000" MCT="17"/>
			<Cell CellID="AK_56" Value="0"/>
			<Cell CellID="AO_56" Value="1707693" MCT="18"/>
		</Cells>
	</Section>
	<Section Dynamic="1" MaxRows="0">
		<Cells>
			<Cell CellID="C_58" Value="20300" FirstCell="0" MCT="19"/>
			<Cell CellID="P_58" Value="" MCT="20"/>
			<Cell CellID="S_58" Value="300.00" MCT="21"/>
			<Cell CellID="X_58" Value="8000000" MCT="22"/>
			<Cell CellID="AC_58" Value="6153846.00" MCT="23"/>
			<Cell CellID="AE_58" Value="30.0" MCT="24"/>
			<Cell CellID="AH_58" Value="500000" MCT="25"/>
			<Cell CellID="AK_58" Value="0" MCT="26"/>
			<Cell CellID="AO_58" Value="1346154" MCT="27"/>
		</Cells>
		<Cells>
			<Cell CellID="C_59" Value="20102" FirstCell="1" MCT="19"/>
			<Cell CellID="P_59" Value="" MCT="20"/>
			<Cell CellID="S_59" Value="600.00" MCT="21"/>
			<Cell CellID="X_59" Value="2000000" MCT="22"/>
			<Cell CellID="AC_59" Value="1538462.00" MCT="23"/>
			<Cell CellID="AE_59" Value="30.0" MCT="24"/>
			<Cell CellID="AH_59" Value="100000" MCT="25"/>
			<Cell CellID="AK_59" Value="0" MCT="26"/>
			<Cell CellID="AO_59" Value="361539" MCT="27"/>
		</Cells>
	</Section>
	<Section Dynamic="0" MaxRows="0">
		<Cells>
			<Cell CellID="X_61" Value="0" MCT="28"/>
		</Cells>
	</Section>
	<Section Dynamic="1" MaxRows="0">
		<Cells>
			<Cell CellID="C_65" FirstCell="0" Value="" MCT="29"/>
			<Cell CellID="P_65" Value="" MCT="30"/>
			<Cell CellID="S_65" Value="0.00" MCT="31"/>
			<Cell CellID="X_65" Value="0" MCT="32"/>
		</Cells>
	</Section>
	<Section Dynamic="1" MaxRows="0">
		<Cells>
			<Cell CellID="C_69" FirstCell="0" Value="" MCT="33"/>
			<Cell CellID="P_69" Value="" MCT="34"/>
			<Cell CellID="S_69" Value="0.00" MCT="35"/>
			<Cell CellID="X_69" Value="0" MCT="36"/>
		</Cells>
	</Section>
	<Section Dynamic="1" MaxRows="0">
		<Cells>
			<Cell CellID="C_73" FirstCell="0" Value="" MCT="37"/>
			<Cell CellID="P_73" Value="" MCT="38"/>
			<Cell CellID="S_73" Value="0.00" MCT="39"/>
			<Cell CellID="X_73" Value="0" MCT="40"/>
		</Cells>
	</Section>
	<Section Dynamic="0" MaxRows="0">
		<Cells>
			<Cell CellID="X_75" Value="19000000" MCT="41"/>
			<Cell CellID="AC_75" Value="13899205.00" MCT="42"/>
			<Cell CellID="AH_75" Value="1500000" MCT="43"/>
			<Cell CellID="AK_75" Value="0"/>
			<Cell CellID="AO_75" Value="3600796" MCT="44"/>
		</Cells>
	</Section>
	<Section Dynamic="0" MaxRows="0">
		<Cells>
			<Cell CellID="AF_77" Value="rtgtggtfhgh"/>
			<Cell CellID="U_77" Value=""/>
			<Cell CellID="U_79" Value=""/>
			<Cell CellID="AF_79" Value="08/05/2012"/>
			<Cell CellID="D_33" Value="0"/>
			<Cell CellID="G_33" Value="1"/>
			<Cell CellID="J_33" Value="1"/>
			<Cell CellID="K_33" Value="3600796"/>
			<Cell CellID="L_33" Value=""/>
			<Cell CellID="M_33" Value="0"/>
		</Cells>
	</Section>
</Sections>
